{
  "schema": "tessera.layout/1",
  "name": "Workshop Shell",
  "description": "A sealed 12 x 12 m workshop shell: nine foundation pads, nine floor slabs, four L corners, a walkable doorway, a glazed window, two plain walls, a six-panel gable roof with ridge caps, and interior props. Every transform solved from the placement contract.",
  "generator": "tessera.assemble.Builder",
  "catalog": {
    "kit": {
      "id": "shell_v1",
      "version": "1.0.0"
    },
    "contract_version": "1.0.0",
    "fingerprint": "0e52a8027687785f4805a0bb2083c45b22b289366631afb1bf598149e7713319"
  },
  "space": {
    "convention": "tessera.space/1",
    "linear_unit": "metre",
    "angle_unit": "degree"
  },
  "bounds": {
    "min": [
      -0.03,
      -0.3,
      0.0
    ],
    "max": [
      12.03,
      12.299999999999999,
      6.3306
    ]
  },
  "instance_count": 41,
  "assets_used": [
    "tsr:shell/door.leaf.1m2",
    "tsr:shell/floor.slab.4m",
    "tsr:shell/foundation.pad.4m",
    "tsr:shell/prop.crate.small",
    "tsr:shell/prop.workbench",
    "tsr:shell/roof.panel.4m",
    "tsr:shell/roof.ridge.4m",
    "tsr:shell/wall.corner.4m",
    "tsr:shell/wall.doorway.4m",
    "tsr:shell/wall.straight.4m",
    "tsr:shell/wall.window.4m",
    "tsr:shell/window.leaf.1m8"
  ],
  "placement_method": {
    "explicit": 0,
    "solved_from_contract": 41
  },
  "instances": [
    {
      "id": "foundation_pad_4m_01",
      "asset": "tsr:shell/foundation.pad.4m",
      "position": [
        0.0,
        0.0,
        0.0
      ],
      "rotation_degrees": [
        0.0,
        0.0,
        0.0
      ],
      "scale": 1.0,
      "connections": [
        {
          "from": "edge_pos_x",
          "to": {
            "instance": "foundation_pad_4m_04",
            "connector": "edge_neg_x"
          }
        },
        {
          "from": "edge_pos_y",
          "to": {
            "instance": "foundation_pad_4m_02",
            "connector": "edge_neg_y"
          }
        }
      ]
    },
    {
      "id": "foundation_pad_4m_02",
      "asset": "tsr:shell/foundation.pad.4m",
      "position": [
        0.0,
        4.0,
        0.0
      ],
      "rotation_degrees": [
        0.0,
        0.0,
        0.0
      ],
      "scale": 1.0,
      "connections": [
        {
          "from": "edge_pos_x",
          "to": {
            "instance": "foundation_pad_4m_05",
            "connector": "edge_neg_x"
          }
        },
        {
          "from": "edge_pos_y",
          "to": {
            "instance": "foundation_pad_4m_03",
            "connector": "edge_neg_y"
          }
        }
      ]
    },
    {
      "id": "foundation_pad_4m_03",
      "asset": "tsr:shell/foundation.pad.4m",
      "position": [
        0.0,
        8.0,
        0.0
      ],
      "rotation_degrees": [
        0.0,
        0.0,
        0.0
      ],
      "scale": 1.0,
      "connections": [
        {
          "from": "edge_pos_x",
          "to": {
            "instance": "foundation_pad_4m_06",
            "connector": "edge_neg_x"
          }
        }
      ]
    },
    {
      "id": "foundation_pad_4m_04",
      "asset": "tsr:shell/foundation.pad.4m",
      "position": [
        4.0,
        0.0,
        0.0
      ],
      "rotation_degrees": [
        0.0,
        0.0,
        0.0
      ],
      "scale": 1.0,
      "connections": [
        {
          "from": "edge_pos_x",
          "to": {
            "instance": "foundation_pad_4m_07",
            "connector": "edge_neg_x"
          }
        },
        {
          "from": "edge_pos_y",
          "to": {
            "instance": "foundation_pad_4m_05",
            "connector": "edge_neg_y"
          }
        }
      ]
    },
    {
      "id": "foundation_pad_4m_05",
      "asset": "tsr:shell/foundation.pad.4m",
      "position": [
        4.0,
        4.0,
        0.0
      ],
      "rotation_degrees": [
        0.0,
        0.0,
        0.0
      ],
      "scale": 1.0,
      "connections": [
        {
          "from": "edge_pos_x",
          "to": {
            "instance": "foundation_pad_4m_08",
            "connector": "edge_neg_x"
          }
        },
        {
          "from": "edge_pos_y",
          "to": {
            "instance": "foundation_pad_4m_06",
            "connector": "edge_neg_y"
          }
        }
      ]
    },
    {
      "id": "foundation_pad_4m_06",
      "asset": "tsr:shell/foundation.pad.4m",
      "position": [
        4.0,
        8.0,
        0.0
      ],
      "rotation_degrees": [
        0.0,
        0.0,
        0.0
      ],
      "scale": 1.0,
      "connections": [
        {
          "from": "edge_pos_x",
          "to": {
            "instance": "foundation_pad_4m_09",
            "connector": "edge_neg_x"
          }
        }
      ]
    },
    {
      "id": "foundation_pad_4m_07",
      "asset": "tsr:shell/foundation.pad.4m",
      "position": [
        8.0,
        0.0,
        0.0
      ],
      "rotation_degrees": [
        0.0,
        0.0,
        0.0
      ],
      "scale": 1.0,
      "connections": [
        {
          "from": "edge_pos_y",
          "to": {
            "instance": "foundation_pad_4m_08",
            "connector": "edge_neg_y"
          }
        }
      ]
    },
    {
      "id": "foundation_pad_4m_08",
      "asset": "tsr:shell/foundation.pad.4m",
      "position": [
        8.0,
        4.0,
        0.0
      ],
      "rotation_degrees": [
        0.0,
        0.0,
        0.0
      ],
      "scale": 1.0,
      "connections": [
        {
          "from": "edge_pos_y",
          "to": {
            "instance": "foundation_pad_4m_09",
            "connector": "edge_neg_y"
          }
        }
      ]
    },
    {
      "id": "foundation_pad_4m_09",
      "asset": "tsr:shell/foundation.pad.4m",
      "position": [
        8.0,
        8.0,
        0.0
      ],
      "rotation_degrees": [
        0.0,
        0.0,
        0.0
      ],
      "scale": 1.0
    },
    {
      "id": "floor_slab_4m_01",
      "asset": "tsr:shell/floor.slab.4m",
      "position": [
        0.0,
        0.0,
        0.3
      ],
      "rotation_degrees": [
        0.0,
        0.0,
        0.0
      ],
      "scale": 1.0,
      "connections": [
        {
          "from": "edge_pos_x",
          "to": {
            "instance": "floor_slab_4m_04",
            "connector": "edge_neg_x"
          }
        },
        {
          "from": "edge_pos_y",
          "to": {
            "instance": "floor_slab_4m_02",
            "connector": "edge_neg_y"
          }
        }
      ]
    },
    {
      "id": "floor_slab_4m_02",
      "asset": "tsr:shell/floor.slab.4m",
      "position": [
        0.0,
        4.0,
        0.3
      ],
      "rotation_degrees": [
        0.0,
        0.0,
        0.0
      ],
      "scale": 1.0,
      "connections": [
        {
          "from": "edge_pos_x",
          "to": {
            "instance": "floor_slab_4m_05",
            "connector": "edge_neg_x"
          }
        },
        {
          "from": "edge_pos_y",
          "to": {
            "instance": "floor_slab_4m_03",
            "connector": "edge_neg_y"
          }
        }
      ]
    },
    {
      "id": "floor_slab_4m_03",
      "asset": "tsr:shell/floor.slab.4m",
      "position": [
        0.0,
        8.0,
        0.3
      ],
      "rotation_degrees": [
        0.0,
        0.0,
        0.0
      ],
      "scale": 1.0,
      "connections": [
        {
          "from": "edge_pos_x",
          "to": {
            "instance": "floor_slab_4m_06",
            "connector": "edge_neg_x"
          }
        }
      ]
    },
    {
      "id": "floor_slab_4m_04",
      "asset": "tsr:shell/floor.slab.4m",
      "position": [
        4.0,
        0.0,
        0.3
      ],
      "rotation_degrees": [
        0.0,
        0.0,
        0.0
      ],
      "scale": 1.0,
      "connections": [
        {
          "from": "edge_pos_x",
          "to": {
            "instance": "floor_slab_4m_07",
            "connector": "edge_neg_x"
          }
        },
        {
          "from": "edge_pos_y",
          "to": {
            "instance": "floor_slab_4m_05",
            "connector": "edge_neg_y"
          }
        }
      ]
    },
    {
      "id": "floor_slab_4m_05",
      "asset": "tsr:shell/floor.slab.4m",
      "position": [
        4.0,
        4.0,
        0.3
      ],
      "rotation_degrees": [
        0.0,
        0.0,
        0.0
      ],
      "scale": 1.0,
      "connections": [
        {
          "from": "edge_pos_x",
          "to": {
            "instance": "floor_slab_4m_08",
            "connector": "edge_neg_x"
          }
        },
        {
          "from": "edge_pos_y",
          "to": {
            "instance": "floor_slab_4m_06",
            "connector": "edge_neg_y"
          }
        }
      ]
    },
    {
      "id": "floor_slab_4m_06",
      "asset": "tsr:shell/floor.slab.4m",
      "position": [
        4.0,
        8.0,
        0.3
      ],
      "rotation_degrees": [
        0.0,
        0.0,
        0.0
      ],
      "scale": 1.0,
      "connections": [
        {
          "from": "edge_pos_x",
          "to": {
            "instance": "floor_slab_4m_09",
            "connector": "edge_neg_x"
          }
        }
      ]
    },
    {
      "id": "floor_slab_4m_07",
      "asset": "tsr:shell/floor.slab.4m",
      "position": [
        8.0,
        0.0,
        0.3
      ],
      "rotation_degrees": [
        0.0,
        0.0,
        0.0
      ],
      "scale": 1.0,
      "connections": [
        {
          "from": "edge_pos_y",
          "to": {
            "instance": "floor_slab_4m_08",
            "connector": "edge_neg_y"
          }
        }
      ]
    },
    {
      "id": "floor_slab_4m_08",
      "asset": "tsr:shell/floor.slab.4m",
      "position": [
        8.0,
        4.0,
        0.3
      ],
      "rotation_degrees": [
        0.0,
        0.0,
        0.0
      ],
      "scale": 1.0,
      "connections": [
        {